{
  "$schema": "../rgaa-rule.schema.json",
  "id": "8.4",
  "ruleId": "mandatory-lang-attribute",
  "title": "Éléments obligatoires - Langue par défaut",
  "description": "Pour chaque page web, le code de langue par défaut est-il présent ?",
  "rgaaReference": "RGAA 4.1 - Critère 8.4",
  "wcagReference": "WCAG 2.1 - 3.1.1 Langue de la page (A)",
  "theme": "Éléments obligatoires",
  "level": "A",
  "applicability": {
    "description": "Toutes les pages web",
    "signals": {
      "selectors": [
        "html"
      ],
      "minimumCount": 1
    },
    "nonApplicableCases": []
  },
  "testScenarios": {
    "htmlLangPresence": {
      "description": "Présence et validité de l'attribut lang",
      "tests": [
        {
          "id": "8.4.1",
          "rgaaTestRef": "Test 8.4.1",
          "description": "La balise <html> possède-t-elle un attribut lang ou xml:lang (XHTML) ?",
          "methodology": [
            "Vérifier présence attribut lang sur <html>",
            "Vérifier format ISO 639-1 (ex: fr, en, de)"
          ],
          "selector": "html:not([lang])",
          "expected": "L'élément <html> doit avoir un attribut lang valide",
          "severity": "critical",
          "type": "violation",
          "automatable": true,
          "aiAnalysis": false
        },
        {
          "id": "8.4.2",
          "rgaaTestRef": "Test 8.4.2",
          "description": "Le code de langue est-il pertinent (correspond au contenu principal) ?",
          "methodology": [
            "Lire le contenu de la page",
            "Vérifier que lang correspond à la langue principale"
          ],
          "selector": "html[lang]",
          "expected": "Le code lang doit correspondre à la langue réelle du contenu",
          "severity": "serious",
          "type": "violation",
          "automatable": false,
          "aiAnalysis": true,
          "aiPromptContext": {
            "detectPageLanguage": true,
            "compareWithLangAttribute": true
          }
        }
      ]
    }
  },
  "aiAnalysisConfig": {
    "enabled": true,
    "extractionRules": {
      "selectors": [
        "html",
        "body",
        "h1",
        "p"
      ],
      "attributes": [
        "lang",
        "xml:lang"
      ],
      "context": {
        "surroundingText": 500,
        "includeComputedA11yTreeHints": false
      }
    },
    "analysisPrompt": {
      "tasks": [
        "Objectif : vérifier le critère RGAA 8.4 (présence et pertinence du code de langue par défaut sur la balise <html>). S'appuyer sur les attributs RÉELS du DOM extrait, puis appliquer la procédure ci-dessous DANS L'ORDRE.",
        "ÉTAPE 1 (signal mécanique) — Relever sur l'élément <html> la présence ou l'ABSENCE de l'attribut lang (ou xml:lang en XHTML) et sa valeur EXACTE (chaîne brute, vide ou non).",
        "ÉTAPE 2 (violation objective) — Si <html> ne porte AUCUN attribut lang/xml:lang, ou si lang est présent mais VIDE (lang=\"\") → finding type=\"violation\", severity critical : la langue par défaut n'est pas déclarée, signal vérifiable sans interprétation.",
        "ÉTAPE 3 (violation objective) — Si la valeur de lang est syntaxiquement INVALIDE au regard de BCP 47 / ISO 639-1 (ex. \"français\", \"anglais\", \"fra-cy\", code inexistant) → finding type=\"violation\", severity critical : code de langue malformé, défaut objectif détectable mécaniquement.",
        "ÉTAPE 4 (doute → warning) — Si lang est présent et syntaxiquement valide mais que sa PERTINENCE par rapport à la langue réelle du contenu principal dépend d'une appréciation éditoriale (le texte semble être dans une autre langue, ou la page est multilingue, ou le contenu est trop court pour trancher) → NE PAS conclure à une violation ferme : émettre un finding type=\"warning\" demandant une vérification manuelle de la correspondance lang ↔ contenu.",
        "ÉTAPE 5 (conforme) — Si lang est présent, valide et cohérent avec la langue manifeste du contenu, ne produire AUCUN finding (compliant=true).",
        "ÉTAPE 6 — Ce critère n'est jamais NON APPLICABLE : la balise <html> est toujours présente. Si l'élément <html> est absent du DOM extrait, le signaler en warning (vérification manuelle)."
      ],
      "important": [
        "Déterminisme : les mêmes signaux DOM (présence/valeur de lang) doivent toujours produire le même verdict.",
        "type=\"violation\" est réservé aux défauts OBJECTIFS : lang absent, vide, ou syntaxiquement invalide.",
        "En cas de doute sur la PERTINENCE du code (langue réelle du contenu, page multilingue, texte trop court) → type=\"warning\" pour vérification manuelle, jamais de violation ferme.",
        "Ce critère s'applique toujours (balise <html> obligatoire) : pas de conclusion non applicable.",
        "Retourner UNIQUEMENT du JSON valide, sans texte avant ou après.",
        "Limiter à 5 findings maximum, descriptions concises (max 150 caractères)."
      ],
      "outputFormat": {
        "description": "Format JSON strict à respecter",
        "structure": {
          "ruleId": "string",
          "compliant": "boolean",
          "severity": "critical|serious|moderate|minor|none",
          "summary": "string",
          "totalElements": "number",
          "findings": "array - Maximum 5 findings principaux"
        },
        "findingsFormat": {
          "type": "violation|warning|recommendation",
          "element": "css selector",
          "issue": "string<=200",
          "recommendation": "string",
          "rgaaTestRef": "Test 8.4.1 ou 8.4.2",
          "wcagReference": "3.1.1"
        }
      }
    },
    "correctionSuggestions": {
      "enabled": true,
      "includeCodeExamples": true,
      "prioritization": "severity"
    },
    "systemRole": "Expert en accessibilité numérique RGAA 4.1 (critère 8.4 - Langue par défaut), spécialisé dans la vérification déterministe de l'attribut lang de la balise <html>. Tu signales en violation ferme uniquement les défauts objectifs du DOM (lang absent, vide ou syntaxiquement invalide) et tu demandes une vérification manuelle (warning) dès que la pertinence du code de langue par rapport au contenu réel dépend d'une appréciation."
  },
  "automatedChecks": [
    "Présence attribut lang sur html",
    "Format du code langue (ISO 639-1)"
  ],
  "manualChecks": [
    "Pertinence du code langue par rapport au contenu"
  ],
  "commonErrors": [
    {
      "error": "Absence de lang",
      "example": "<html>",
      "correction": "<html lang=\"fr\">",
      "explanation": "Toute page doit déclarer sa langue par défaut via l'attribut lang sur <html> : absence = violation objective."
    },
    {
      "error": "Attribut lang vide",
      "example": "<html lang=\"\">",
      "correction": "<html lang=\"fr\">",
      "explanation": "Un lang vide équivaut à une absence de déclaration de langue : c'est une violation."
    },
    {
      "error": "Code langue syntaxiquement invalide",
      "example": "<html lang=\"français\">",
      "correction": "<html lang=\"fr\">",
      "explanation": "Le code doit respecter BCP 47 / ISO 639-1 (fr, en, de…). Un libellé en toutes lettres est invalide : violation objective."
    },
    {
      "error": "Code langue valide mais possiblement non pertinent (à vérifier manuellement)",
      "example": "<html lang=\"en\"><body><p>Bonjour et bienvenue sur notre site.</p></body></html>",
      "correction": "<html lang=\"fr\"><body><p>Bonjour et bienvenue sur notre site.</p></body></html>",
      "explanation": "Le code est syntaxiquement valide mais semble ne pas correspondre au contenu : la correspondance lang ↔ langue réelle relève d'une appréciation et doit être confirmée manuellement (warning)."
    }
  ],
  "resources": [
    "https://accessibilite.numerique.gouv.fr/methode/criteres-et-tests/#8.4",
    "https://www.w3.org/WAI/WCAG21/Understanding/language-of-page.html"
  ]
}
